{
  "rooms": [
    {
      "room": "balcony",
      "position": "south",
      "dimensions": {},
      "adjacent_rooms": [],
      "directions": [
        "south",
        "north"
      ]
    },
    {
      "room": "bathroom",
      "position": "northeast",
      "dimensions": {},
      "adjacent_rooms": [
        "common room",
        "living room"
      ],
      "directions": [
        "northeast",
        "south",
        "west"
      ]
    },
    {
      "room": "common room",
      "position": "east",
      "dimensions": {},
      "adjacent_rooms": [
        "bathroom",
        "master room",
        "living room"
      ],
      "directions": [
        "east",
        "north",
        "south",
        "west"
      ]
    },
    {
      "room": "kitchen",
      "position": "southwest",
      "dimensions": {},
      "adjacent_rooms": [
        "living room",
        "master room"
      ],
      "directions": [
        "southwest",
        "north",
        "east"
      ]
    },
    {
      "room": "living room",
      "position": "northwest",
      "dimensions": {},
      "adjacent_rooms": [
        "bathroom",
        "common room",
        "master room",
        "kitchen"
      ],
      "directions": [
        "northwest",
        "east",
        "south",
        "west",
        "south"
      ]
    },
    {
      "room": "master room",
      "position": null,
      "dimensions": {
        "width": 15,
        "depth": 30,
        "square_footage": 400
      },
      "adjacent_rooms": [],
      "directions": []
    },
    {
      "room": "master room",
      "position": "east",
      "dimensions": {},
      "adjacent_rooms": [
        "living room",
        "common room",
        "balcony",
        "kitchen"
      ],
      "directions": [
        "east",
        "northwest",
        "north",
        "south",
        "west"
      ]
    }
  ],
  "total_rooms": 7,
  "raw_text": "The balcony juts out on the south side, with the master to the north. It is approximately 12 feet wide by 5 feet deep, for a total square footage of 60. The bathroom is in the northeast corner with the common room to the south and the living room to the west. It is approximately 12 feet wide by 5 feet deep, for a total square footage of 60. The common room is on the east side with the bathroom to the north, the master room to the south and the living room to the west. Half of the south wall is exterior. It is approximately 12 feet wide by 10 feet deep, for a total square footage of 120. The kitchen is in the southwest corner with the living room to the north and the master room to the east. It is approximately 10 feet wide by 10 feet deep, for a total square footage of 100. The living room is at the northwest corner, with the bathroom and common room to the east, the master room inset at the south west corner, and the kitchen to the south. It is approximately 15 feet wide by 30 feet deep, minus the knock out for the master room, for a total square footage of 400. The master room is on the east side with the living room at the northwest corner, the common room to the north, balcony to the south, and kitchen to the west. It is approximately 12 feet wide by 20 feet deep, for a total square footage of 240.",
  "total_square_footage": 400,
  "id": "10017",
  "source_annotation": "data/raw/annotations/10017.txt",
  "source_image": "data/raw/images/10017.png"
}