{
  "rooms": [
    {
      "room": "bathroom",
      "position": "south",
      "dimensions": {},
      "adjacent_rooms": [
        "living room",
        "common room",
        "common room"
      ],
      "directions": [
        "south",
        "north",
        "east",
        "west"
      ]
    },
    {
      "room": "common room",
      "position": "southwest",
      "dimensions": {},
      "adjacent_rooms": [
        "living room",
        "bathroom"
      ],
      "directions": [
        "southwest",
        "north",
        "northeast",
        "east"
      ]
    },
    {
      "room": "common room",
      "position": "south",
      "dimensions": {},
      "adjacent_rooms": [
        "master room",
        "bathroom",
        "living room"
      ],
      "directions": [
        "south",
        "east",
        "west",
        "north",
        "north",
        "west"
      ]
    },
    {
      "room": "kitchen",
      "position": "northeast",
      "dimensions": {},
      "adjacent_rooms": [],
      "directions": [
        "northeast"
      ]
    },
    {
      "room": "living room",
      "position": "northwest",
      "dimensions": {},
      "adjacent_rooms": [
        "kitchen",
        "master room",
        "common room",
        "bathroom"
      ],
      "directions": [
        "northwest",
        "east",
        "south"
      ]
    },
    {
      "room": "bathroom",
      "position": "south",
      "dimensions": {
        "width": 30,
        "depth": 15,
        "square_footage": 450
      },
      "adjacent_rooms": [],
      "directions": [
        "south",
        "center"
      ]
    },
    {
      "room": "master room",
      "position": "southeast",
      "dimensions": {},
      "adjacent_rooms": [
        "kitchen",
        "living room",
        "common room"
      ],
      "directions": [
        "southeast",
        "north",
        "west"
      ]
    }
  ],
  "total_rooms": 7,
  "raw_text": "The bathroom is on the south side with the living room to the north, common room 2 to the east and common room 2 to the west. It is approximately 5 feet wide by 6 feet deep, for a total square footage of 30. Common room 1 is at the southwest corner, with the living room to the north and northeast, and the bathroom to the east. It is approximately 15 feet wide by 12 feet deep, for a total square footage of 180. Common room 2 is on the south side with the master room to the east, bathroom to the west, and the living room to the north and north west. It is approximately 10 feet wide by 10 feet deep, for a total square footage of 100. The kitchen is in the northeast corner and juts out about 5 feet, giving it a small southerly exterior wall. It is approximately 15 feet wide by 8 feet deep, for a total square footage of 120. The living room is in the northwest corner, with the kitchen and master room to the east, to the south is common room 1&2 and the bathroom. It is approximately 30 feet wide by 15 feet deep, for a total square footage of 450, plus a small extension to the south at the center leading to the bathroom. The master room is in the southeast corner, with the kitchen to the north, and the living room and common room 2 to the west. It is approximately 10 feet wide by 15 feet deep, for a total square footage of 150.",
  "total_square_footage": 450,
  "id": "64",
  "source_annotation": "data/raw/annotations/64.txt",
  "source_image": "data/raw/images/64.png"
}