{
  "rooms": [
    {
      "room": "balcony",
      "position": "southwest",
      "dimensions": {},
      "adjacent_rooms": [
        "living room"
      ],
      "directions": [
        "southwest"
      ]
    },
    {
      "room": "balcony",
      "position": "south",
      "dimensions": {},
      "adjacent_rooms": [
        "living room"
      ],
      "directions": [
        "south"
      ]
    },
    {
      "room": "balcony",
      "position": "center",
      "dimensions": {},
      "adjacent_rooms": [],
      "directions": [
        "center",
        "east",
        "west",
        "north"
      ]
    },
    {
      "room": "kitchen",
      "position": "east",
      "dimensions": {},
      "adjacent_rooms": [
        "bathroom",
        "living room",
        "kitchen",
        "bathroom",
        "living room"
      ],
      "directions": [
        "east",
        "north",
        "north"
      ]
    },
    {
      "room": "balcony",
      "position": null,
      "dimensions": {},
      "adjacent_rooms": [],
      "directions": []
    },
    {
      "room": "bathroom",
      "position": "middle",
      "dimensions": {},
      "adjacent_rooms": [],
      "directions": [
        "middle",
        "east",
        "west",
        "north",
        "south",
        "north",
        "south"
      ]
    },
    {
      "room": "balcony",
      "position": "south",
      "dimensions": {},
      "adjacent_rooms": [
        "living room",
        "common room",
        "balcony",
        "common room",
        "living room"
      ],
      "directions": [
        "south",
        "west",
        "northeast"
      ]
    },
    {
      "room": "bathroom",
      "position": null,
      "dimensions": {},
      "adjacent_rooms": [],
      "directions": []
    },
    {
      "room": "common room",
      "position": "northeast",
      "dimensions": {},
      "adjacent_rooms": [
        "bathroom",
        "living room",
        "master room"
      ],
      "directions": [
        "northeast"
      ]
    },
    {
      "room": "bathroom",
      "position": "east",
      "dimensions": {},
      "adjacent_rooms": [
        "living room",
        "master room"
      ],
      "directions": [
        "east",
        "north"
      ]
    },
    {
      "room": "common room",
      "position": null,
      "dimensions": {},
      "adjacent_rooms": [],
      "directions": []
    },
    {
      "room": "kitchen",
      "position": "northwest",
      "dimensions": {},
      "adjacent_rooms": [
        "balcony",
        "living room"
      ],
      "directions": [
        "northwest"
      ]
    },
    {
      "room": "balcony",
      "position": "west",
      "dimensions": {},
      "adjacent_rooms": [
        "living room"
      ],
      "directions": [
        "west",
        "north"
      ]
    },
    {
      "room": "kitchen",
      "position": null,
      "dimensions": {
        "square_footage": 50
      },
      "adjacent_rooms": [],
      "directions": []
    },
    {
      "room": "living room",
      "position": "middle",
      "dimensions": {},
      "adjacent_rooms": [],
      "directions": [
        "middle",
        "north",
        "south"
      ]
    },
    {
      "room": "living room",
      "position": null,
      "dimensions": {},
      "adjacent_rooms": [
        "kitchen",
        "balcony",
        "balcony",
        "bathroom",
        "common room",
        "master room",
        "balcony"
      ],
      "directions": []
    },
    {
      "room": "kitchen",
      "position": "south",
      "dimensions": {},
      "adjacent_rooms": [
        "balcony",
        "bathroom",
        "common room",
        "balcony",
        "master room"
      ],
      "directions": [
        "south",
        "southwest",
        "north",
        "west"
      ]
    },
    {
      "room": "living room",
      "position": null,
      "dimensions": {
        "square_footage": 600
      },
      "adjacent_rooms": [],
      "directions": []
    },
    {
      "room": "master room",
      "position": "southeast",
      "dimensions": {},
      "adjacent_rooms": [
        "common room",
        "living room"
      ],
      "directions": [
        "southeast"
      ]
    },
    {
      "room": "master room",
      "position": "south",
      "dimensions": {},
      "adjacent_rooms": [
        "common room",
        "living room"
      ],
      "directions": [
        "south",
        "east"
      ]
    }
  ],
  "total_rooms": 20,
  "raw_text": "The balcony 1 is located at the southwest point of the floor plan touching the southernmost and a western wall as well as the living room. The balcony 1 lies south of the living room and is approximately 12 ft in width by 4 ft in length for a total of 48 square ft. Balcony 2 is located in the center of the east to west axis and furthest north of the plan touching the northernmost wall and an eastern facing wall. It also touches the kitchen, bathroom, and living room being located east of the kitchen, north of the bathroom, and north of the living room. Balcony 2 is approximately 10 ft in width by 3 ft in length for a total of 30 square ft. The bathroom is located in the middle of the floor plan on the east to west axis but far more north than south on the north to south axis. It touches the balcony, living room, and common room where it is located south of the balcony, west of the common room, and northeast of the living room. The bathroom is approximately 5 ft in width by 5 ft in length for a total of 25 square ft. The common room is located in the northeast portion of the floor plan touching a northern wall and the easternmost wall as well as the bathroom, living room, and the master room. It is east of the bathroom and living room and north of the master room. The approximate size of the common room is 10 ft wide by 12 ft in length for a total of 120 square ft. The kitchen is located at the northwest most corner of the floor plan touching the westernmost and northernmost walls as well as the balcony and living room. It is west  of the balcony and north of the living room. The approximate size of the kitchen is 10 ft by 5 ft for a total square footage of 50 square ft. The living room is located on one of the western walls of the floor plan taking up the middle 75% of the floor plan on the north to south axis with a western facing front door. The living room touches the kitchen, balcony 1, balcony 2, bathroom, common room, master room, and the balcony. It is south of the kitchen and balcony, southwest of the bathroom and common room, north of the balcony, and west of the master room. The approximate size of the living room is 15 ft in width by 25 ft in length for a total square footage of 600 sq ft. The master room is located at the southeast corner of the floor plan touching a southern wall and easternmost wall as well as the common room and living room. The master room is south of the common room and east of the living room. It has an approximate size of 12 ft in width by 15 ft in length for a total of 180 square ft.",
  "total_square_footage": 650,
  "id": "70951",
  "source_annotation": "data/raw/annotations/70951.txt",
  "source_image": "data/raw/images/70951.png"
}